id	category	subcategory	level	audience	question	option_a	option_b	option_c	option_d	correct	explanation	hint	xp	tags
Q036	THINK	consequences	3	youth	You know something about someone that would really change how your friend group sees them. You are tempted to share it. Before you do, what is the most important question to ask yourself?	Is it interesting enough to be worth sharing?	Is it actually mine to share?	Will it make people like me more?	Is it definitely true?	b	This comes up with secrets, with things overheard, with information that was shared with you privately. Information that was given to you in trust is not automatically yours to pass on. Asking whether it is yours to share is the question that stops the most damage.	Just because you know something does not mean it is yours to share.	30	think first,trust,consequences,honesty
Q037	THINK	decision making	1	youth	You have a big piece of homework due Friday. It is Monday. What is the smartest thing to do today?	Leave it until Thursday — you work better under pressure	Break it into small bits and do one bit each day	Do it all tonight and get it over with	Ask a friend to help you last minute	b	This works for any big task — a project, tidying a room, getting ready for something important. Doing a tiny bit each day means no single day feels too much. The whole thing gets done without one horrible evening.	Does a big task have to be done all at once?	10	think first,planning,homework,time management
Q038	THINK	decision making	2	youth	You have fifteen minutes before school and three things to do — find your PE kit, eat breakfast and brush your teeth. What order makes most sense?	Breakfast first because you are hungry	PE kit first because you do not know how long it will take	Teeth first because it is quickest	It does not matter — just do them in any order	b	When time is short do the unpredictable thing first. Finding a PE kit might take one minute or ten — you do not know. Do that first while you still have time. Then the rest is quick and predictable. This works any time you have a list of things and one of them might surprise you.	Which task could take much longer than you expect?	20	think first,planning,time management,decision making
Q039	MAN	manners	1	youth	Someone you do not know holds the door open for you. What do you do?	Walk through without saying anything — they chose to do it	Say thank you and make eye contact	Nod at them	Say something funny	b	This is one of those tiny moments that happens every day — doors, someone passing something, someone letting you go first. Saying thank you and making eye contact takes one second and it matters more than most people realise. It tells the other person they were seen.	Does a small kind moment deserve to be noticed?	10	manners,gratitude,politeness
Q040	MAN	manners	1	youth	You are at a friend's house for dinner and you do not like the food. What do you do?	Tell them honestly it is not nice	Eat what you can and say thank you for dinner	Feed it to the family dog when nobody is looking	Ask for something different	b	Someone made that meal and thought about you when they did. Eating what you can and saying thank you honours the effort they made. This comes up at friends' houses, at family meals, at any time someone cooked for you. It is only one meal — and being a good guest is remembered.	Who made the effort here and how does your reaction affect them?	10	manners,gratitude,hospitality
Q041	MAN	manners	2	youth	You are talking with a friend and you suddenly remember something funny you want to say. They have not finished speaking yet. What should you do?	Jump in — your story is relevant	Wait for them to finish and then share it	Say sorry to interrupt but and jump in	Forget your story — it was probably not that good	b	This comes up in every conversation — at lunch, in class, with family. Waiting for someone to finish what they are saying before you speak tells them that what they are saying matters to you. It is one of the simplest and most noticed things about how someone talks to other people.	Are you listening or just waiting for your turn?	20	manners,listening,communication
Q042	MAN	manners	2	youth	You bump into someone in the corridor and knock their stuff on the floor. It was an accident. What do you do?	Keep walking — it was an accident so it does not really count	Say sorry and help pick it up	Say sorry quickly and keep walking	Look at them and wait to see if they say anything	b	Accidents happen — in corridors, at lunch, in the street. Saying sorry and helping straight away shows you care about how your actions affect someone even when you did not mean it. It takes about ten seconds and it matters.	Does it being an accident change whether you should do something about it?	10	manners,apologies,kindness
Q043	MAN	manners	3	youth	Your friend group has a habit of being quite loud and taking up a lot of space on the bus home. You notice other passengers looking uncomfortable. What do you do?	Nothing — you are allowed to be on the bus	Say to the group quietly let's bring it down a bit	Tell everyone individually to be quieter	Leave it — it is not your job to manage the group	b	Public spaces are shared — buses, libraries, shops, waiting rooms. Being aware of how much space your group takes up and saying something quietly about it is not being boring. It is noticing that other people are in the space too. One quiet word from the right person is usually enough.	Does a shared space belong to your group or to everyone in it?	30	manners,public spaces,awareness,leadership
Q044	CARE	self-care	1	youth	You have been on a screen for two hours. Your eyes feel tired and your neck aches. What should you do?	Keep going — you are in the middle of something	Take a break, look at something far away and move around	Switch to a different screen — that counts as a break	Have a snack and carry on	b	Your body sends clear signals when it needs a rest — tired eyes, stiff neck, headache. These happen during gaming, watching things, doing homework on a screen. The signals are worth listening to. A short break and some movement resets both your body and your brain.	What is your body trying to tell you right now?	10	self-care,screen time,body signals
Q045	CARE	self-care	1	youth	You skipped breakfast because you were running late. By mid-morning you cannot concentrate and everything is annoying you. What is probably happening?	You are just not a morning person	Your brain is running low on fuel and it is showing in your mood and focus	The lesson is boring	You did not sleep enough	b	Your brain runs on food. Skipping breakfast affects concentration and mood more than most people realise — in lessons, in training, in anything requiring focus. It is one of the most direct connections between what you do and how your brain works.	What did your brain not get this morning that it needs to work?	10	self-care,nutrition,focus,body signals
Q046	CARE	sleep	2	youth	You need to sleep but you keep checking your phone and you are not tired. The most useful thing to do is...	Keep going until you feel tired naturally	Put the phone in another room and do something calm instead	Turn the brightness down so it is less harmful	Watch something on TV instead	b	Phone screens tell your brain to stay awake even when you want to sleep. This affects how quickly you fall asleep and how well you sleep. Putting the phone in another room and doing something calm — reading, drawing, just lying quietly — lets your brain switch into sleep mode. This works on school nights, before matches, before any big day.	What is the screen doing to your brain's sleep signals right now?	20	self-care,sleep,screens,habits
Q047	CARE	self-awareness	2	youth	You are worrying about something happening tomorrow and you cannot stop thinking about it. What helps most?	Lie awake going over every possible thing that could go wrong	Write the worry down on paper and then put the paper away	Stay up late to distract yourself	Pretend you are not worried	b	Writing a worry down moves it from going round in your head onto paper — which often makes your brain feel like it has been recorded safely and it can stop repeating it. This works before tests, matches, performances, anything you are nervous about. The paper holds the worry so your head does not have to.	What happens to a worry when you write it down instead of carrying it in your head?	20	self-care,anxiety,worry,sleep
Q048	CARE	self-awareness	3	youth	After a really hard day you get home and just want to lie on your bed and do nothing for a while. Is that ok?	No — you should get your homework done while it is fresh	Yes — your brain and body sometimes need time to recover before you do anything else	No — lying around makes you feel worse	Yes — but only if you feel ill	b	After a demanding day your brain and body need time to come down before they are ready to do more. This is true after a difficult school day, a hard match, a stressful event. Giving yourself a short recovery time first usually means you do better at whatever comes next than if you push straight into it.	Does your brain work the same at the end of a hard day as at the start?	30	self-care,recovery,wellbeing,rest
Q049	FOCUS	focus	1	youth	You have been trying to read for ten minutes and your mind keeps wandering off to other things. What is the best response?	Give up — you clearly cannot focus today	Notice that your mind wandered, come back to the page and try again	Read faster so it is over sooner	Read the same sentence over and over until it goes in	b	Mind wandering during reading happens to everyone — in lessons, doing homework, reading anything that takes effort. The skill is noticing when your mind has drifted and bringing it back. Every single time you do that you are practising focus. The wandering is not the failure. Giving up would be.	What should you do the moment you notice your mind has drifted?	10	focus,reading,attention,habits
Q050	FOCUS	focus	2	youth	You need to do your homework but your phone keeps buzzing with messages. What works best?	Check each message as it arrives then refocus	Put your phone in another room until the homework is done	Turn the sound off but keep it next to you	Check messages every five minutes as a short break	b	Every notification breaks your concentration — and it takes longer to get back into the work than the check took. This is true during homework, during revision, during anything requiring proper focus. Putting the phone out of reach removes the pull completely. Short focused work beats long distracted work every time.	What happens to your focus every single time you check a message?	20	focus,phones,homework,concentration
Q051	SIT	reading the room	2	youth	You walk into the classroom and everyone is sitting quietly while the teacher writes on the board. What should you do?	Say hello to your friends loudly so they know you are there	Sit down quietly and get your things out	Ask the teacher what they are writing	Start unpacking loudly	b	Reading the room means looking at what is happening around you and matching it. This works in classrooms, in someone's house, in any space where you are arriving into something already happening. The room tells you what it needs before anyone says a word.	What is the room already telling you before anyone speaks?	10	situations,reading the room,social awareness
Q052	SIT	reading the room	2	youth	You are telling a story and you notice two people have started looking away and one is checking their phone. What does this probably mean?	They are thinking carefully about what you are saying	Their attention has drifted and the story might need to end soon	They are being deliberately rude	They are all checking the same thing	b	When people look away or check their phones while you are talking it usually means their attention has moved on. This is information — not an attack. Noticing it means you can choose to wrap up, change direction or ask them something. Not noticing it means you keep going into a room that has already moved on.	What are the people in front of you actually showing you right now?	20	situations,reading the room,communication,awareness
Q053	SIT	timing	2	youth	You have brilliant news to share but your teacher looks very stressed and busy right now. What should you do?	Tell them immediately — your news is important	Wait until they look less rushed then share it	Say it loudly so they hear while they work	Give up — they probably will not care	b	Even good news lands badly when someone is not ready to hear it. This works in any situation — a parent who is on the phone, a friend who is upset, a teacher mid-task. Waiting for the right moment is not giving up. It is making sure the news actually gets heard properly.	Is right now actually a good moment for the other person?	20	situations,timing,awareness,reading the room
Q054	SIT	body language	2	youth	Your friend says they are fine but they have gone quiet, are not making eye contact and have stopped joining in. What does this probably mean?	They are fine — they said so	Something is probably wrong even though they said they are fine	They are tired	They are annoyed at you specifically	b	What people say and what their body shows are sometimes different. Going quiet, avoiding eye contact, pulling back — these are signals worth noticing. This comes up with friends, with family, with anyone you know well. Asking gently if they are actually ok is usually the right move.	Are the words saying the same thing as everything else?	20	situations,body language,empathy,friendship
Q055	EMO	emotions	2	youth	Something small happens — someone takes the seat you were heading for — and you feel a huge wave of anger that seems too big for what just happened. Why might that be?	You are just an angry person	That small thing probably set off a bigger feeling that was already there	You really needed that seat	You are having a bad reaction to something you ate	b	Big reactions to small things usually mean something bigger was already sitting underneath. This happens to everyone — a small thing tips a feeling that had been building. Knowing this means you can ask yourself what is actually going on rather than staying confused about why you reacted so strongly.	Was the anger really about the seat?	20	emotions,self-awareness,triggers,feelings
Q056	EMO	self-awareness	3	youth	You notice that when one person in your group is in a bad mood the whole group gets quieter and more careful. What does this tell you?	That person is just grumpy	One person's mood is affecting the whole group — that is worth noticing	The whole group must be tired	Everyone is polite	b	One person's mood can set the temperature for a whole group — in a classroom, on a team, in a family. Noticing this in your group means you understand something important about how groups work. It also means you can notice when your own mood might be doing the same thing to the people around you.	Does one person's mood stay only with that person?	30	emotions,group dynamics,self-awareness,awareness
Q057	THINK	identity	3	youth	Your group is about to do something that would mean being unkind to someone else. Going along with it would mean fitting in. Not going along would mean standing out. What is the most honest question to ask yourself?	Will anyone find out if I join in?	Is this actually something I want to do or am I doing it to fit in?	Is it really that bad?	What would happen if I just watched?	b	This moment comes up in schools, in groups, anywhere fitting in and doing the right thing are pulling in different directions. Asking honestly whether you want to do it or whether you are doing it to fit in is the question that tells you most about who you actually are.	Would you do this if nobody was watching?	30	think first,identity,values,peer pressure
Q058	GOAL	goals	1	youth	You want to get better at something — drawing, football, reading, anything. What is the most useful thing to do first?	Wait until you feel ready to start	Pick one small thing to practise and do it a little bit every day	Try to do loads of it all at once to catch up quickly	Ask someone better than you to show you everything	b	Getting better at anything works the same way — a sport, an instrument, a school subject, a skill. A small amount done regularly beats a large amount done once. Your brain learns better through repeated short sessions than through one long one.	Does getting better at something happen all at once or a bit at a time?	10	goals,practice,growth,habits
Q059	GOAL	resilience	2	youth	You set yourself a goal and you were doing well. Then you had one bad week and did nothing. What should you do?	Give up — you already broke the streak	Start a completely new goal instead	Pick up where you left off — one bad week does not end a goal	Do double the amount this week to catch up	c	Missing a week does not end a goal. This is true for reading habits, exercise, practice, anything you are trying to build. What matters is the pattern over time — not whether every single day was perfect. The most important step after a gap is just starting again without making a big deal of the gap.	Is one bad week the same as failing?	20	goals,resilience,habits,growth
Q060	GOAL	growth mindset	2	youth	You get something wrong in class and feel embarrassed. What is the most useful way to think about it?	Getting it wrong means you are not good at that thing	Getting it wrong is information — your brain just found out where it needs to work next	You should have tried harder	Everyone is judging you for it	b	Getting things wrong is how brains learn — in class, on a pitch, in practice, anywhere. The embarrassment is real and it passes quickly. The wrong answer is actually more useful to your brain than a right one because it shows exactly where to focus next.	What does your brain do with a wrong answer that it cannot do with a right one?	20	goals,growth mindset,resilience,learning
Q061	GOAL	goals	3	youth	You have a big goal but every time you think about it you feel overwhelmed and do nothing. What usually helps most?	Wait until you feel less overwhelmed	Break it into the smallest steps you can imagine and do just the first one	Tell yourself it is not that important	Ask someone else to help you plan it	b	Feeling overwhelmed by a big goal is almost always about seeing the whole thing at once rather than just the next step. This works for projects, for big changes, for anything that feels too large. The only step that matters right now is the first one. The rest can wait until that one is done.	Do you need to see the whole path or just the next step?	30	goals,planning,overwhelm,growth
Q062	EMO	empathy	1	youth	A younger child at school is sitting alone and looks upset. You do not know them. What is the kindest thing to do?	Walk past — it is none of your business	Go over quietly and ask if they are ok	Stare at them	Tell your friends about them	b	Noticing when someone needs something and doing something small about it does not require knowing them. This comes up anywhere — a younger child at school, someone on a bus, a person in a waiting room. You do not have to fix anything. Just asking if they are ok can be the whole thing.	Do you have to know someone to be kind to them?	10	emotions,empathy,kindness,courage
Q063	EMO	empathy	2	youth	Your friend got picked for something you both wanted. You feel happy for them but also disappointed for yourself. Is it ok to feel both at the same time?	No — if you are a good friend you should only feel happy for them	Yes — feeling two things at once is completely normal	No — the disappointment means you are jealous	Yes — but you should not let your friend see the disappointment	b	Feeling happy for someone and disappointed for yourself at the same moment is one of the most common human feelings there is. Both feelings are true at the same time and neither cancels the other out. Being honest about this to yourself — even if you do not say it out loud — is much better than pretending one of them is not there.	Can two feelings that seem opposite both be true at the same time?	20	emotions,empathy,friendship,feelings
Q064	THINK	reading people	2	youth	Someone gives you a compliment right before asking you for a favour. Something feels slightly off about the compliment. Should you notice that feeling?	No — a compliment is always nice so just enjoy it	Yes — your instinct that something feels off is worth paying attention to	No — you are being paranoid	Yes — and you should refuse whatever they ask	b	Noticing when something feels slightly off — even something that looks positive — is a useful skill. Compliments can be genuine and they can also be used to soften someone up before a request. Noticing the feeling does not mean assuming the worst. It just means paying attention to what comes next.	What comes after the compliment?	20	think first,reading people,instinct,awareness
Q065	THINK	reading people	3	youth	Someone in your group is very kind to you — always there, always helping. But every time you try to do something on your own they seem a bit hurt or jump in to take over. What is worth noticing about this pattern?	They are just a very kind person	Their helpfulness might be about keeping you needing them as much as it is about helping you	They do not trust you to manage on your own	You should feel grateful rather than suspicious	b	Kindness that makes you less independent rather than more is worth looking at carefully. This comes up in friendships, in family, in any relationship. You can appreciate the care someone offers while also noticing whether it builds you up or keeps you reliant. Both things can be true.	Does real help make you more capable or more dependent?	30	think first,relationships,independence,reading people
Q066	SIT	reading people	2	youth	You are telling your friend something important and they say the right things but keep glancing at their phone. What is probably happening?	They are listening carefully	Part of their attention is somewhere else even though they are saying the right words	They are waiting for an important message	They find what you are saying boring	b	What someone says and where their attention actually is are sometimes different things. Glancing at a phone, half-turned away, eyes moving — these show you where someone's focus really is. Noticing this does not mean getting upset. It might just mean this is not the right moment for that conversation.	Where is their attention actually going?	20	situations,reading people,communication,awareness
Q067	MAN	conflict	2	youth	You think your teacher made a mistake in marking your work. You believe your answer was right. What is the best way to bring it up?	Say nothing — teachers are always right	Bring it up quietly after class and explain your thinking calmly	Argue about it in front of the class	Write a note and leave it on their desk	b	Disagreeing with someone in authority — a teacher, a coach, a parent — is sometimes completely valid. How you do it matters as much as what you say. Calmly, privately, with your reasoning ready gives you the best chance of being heard. In front of everyone usually just creates a situation rather than solving one.	Is there a way to disagree that makes it more likely you will be heard?	20	manners,conflict,assertiveness,communication
Q068	MAN	conversations	1	youth	You are in a conversation and you realise you have been talking about yourself for quite a long time. What should you do?	Keep going — they would say something if they were bored	Ask them something about themselves and actually listen to the answer	Say anyway and keep talking	Apologise and go quiet	b	Good conversations go back and forth. Noticing that you have been going for a while and asking about the other person is a simple and very noticed thing to do. This works with friends, with family, with anyone you are talking to. It tells them you are interested in more than just your own story.	Is a good conversation mostly about talking or about balance?	10	manners,communication,listening,relationships
Q069	CARE	routines	1	youth	You wake up late and everything feels rushed and stressful. Which one habit would make the biggest difference to your mornings?	Going to bed later so you are not as tired when you wake up	Getting your bag ready and clothes out the night before	Setting three alarms instead of one	Eating breakfast faster	b	Almost all morning stress comes from decisions that could have been made the night before. Bag packed, clothes ready, tomorrow checked — doing these things before bed means the morning is just carrying out a plan rather than making panicked decisions in a rush.	When is the best time to prepare for tomorrow?	10	self-care,routines,planning,morning
Q070	CARE	body awareness	2	youth	You have been sitting doing homework for an hour and you feel foggy and restless. What does your body need?	More time — the foggy feeling will pass if you push through	To move — even five minutes of movement resets your brain and body	A snack so you have more energy to concentrate	To stop for the day	b	Your brain and body are not designed to stay still for long periods. The foggy restless feeling after a long sit is your body asking to move. Five minutes of actual movement — walking, stretching, going outside — resets both brain and body more effectively than any other short break.	What does restless actually mean when your body says it?	20	self-care,body awareness,focus,movement
