id	category	subcategory	level	audience	question	option_a	option_b	option_c	option_d	correct	explanation	hint	xp	tags
Q104	EMO	feelings	2	youth	You worked really hard on your art project. The teacher says it is good but not brilliant. You feel crushed even though nobody was mean. Why might you feel that way?	Because you are too sensitive	Because you cared about it — and when something matters feedback hits harder	Because art does not count	Because the teacher is wrong	b	This happens with anything you put real effort into — a story, a goal, a project. The more you cared the more the feedback lands. That is not weakness. It means you tried properly.	Does caring about something change how feedback feels?	10	emotions,effort,feedback,feelings
Q105	EMO	feelings	3	youth	You told your friend a secret and now you are pretty sure they told someone else. You feel sick about it but have no proof. What do you do with that feeling right now?	Ignore it — you might be wrong	Notice it is there, do not act on it yet, and keep your eyes open	Tell everyone your friend cannot be trusted	Confront your friend in front of the group	b	That sick feeling when trust might have been broken comes up in lots of situations — when something private gets around school, when someone's reaction tells you more than their words. Acting before you have proof usually makes things messier. Noticing and waiting is harder but smarter.	Is a feeling proof of something or just a signal worth watching?	20	emotions,trust,instinct,feelings
Q106	EMO	feelings	3	youth	Everyone in your group laughed at something. You did not find it funny — you actually felt uncomfortable. But you laughed anyway. Why do people do that?	Because they are liars	Because fitting in feels safer than being the only one who does not laugh	Because it was probably funny and they did not realise	Because they are trying to impress someone	b	This happens in classrooms, on sports teams, at family gatherings. Laughing along when you do not mean it is something almost everyone does. Noticing when you are doing it is the first step to choosing something different next time.	Is there a difference between laughing because something is funny and laughing for another reason?	20	emotions,belonging,peer pressure,identity
Q107	SIT	group dynamics	1	youth	Callum got tuna again. He looks like he might actually cry. Joel has pizza. Callum wants to swap. Joel does not want to but everyone at the table is telling him to. What should Joel do?	Give up the pizza because everyone is saying to	Pretend he cannot hear and eat the pizza very fast	Offer to swap half so they both get something decent	Say no and deal with Callum's sad face	c	This kind of pressure comes up everywhere — who picks the film, who gets the last seat, who has to go in goal. Going along just because people are loud is not the same as agreeing. Finding a middle usually works better for everyone.	Does the loudest opinion have to win?	10	situations,peer pressure,fairness,group dynamics
Q108	SIT	group dynamics	2	youth	Your group has decided to give someone the silent treatment. You do not think it is fair but everyone else is doing it. What do you do?	Join in — you do not want it to be you next	Stay friendly with that person even if the group notices	Tell the teacher straight away	Tell the person being ignored what the group is doing	b	Groups can freeze someone out at school, in a sports team, in a club. Going along because everyone else does feels easier. But staying decent to someone being ignored does not make you the enemy — it makes you the one person actually doing the right thing.	Is doing the right thing harder when everyone else is doing something different?	20	situations,kindness,peer pressure,group dynamics
Q109	SIT	group pressure	2	youth	You said you did not want to join in with something. Now two people are saying come on, do not be boring, everyone else is doing it. What is probably happening?	They are right and you are being boring	The group is uncomfortable with one person thinking differently and trying to close that gap	They are being mean on purpose	You should just go along with it this time	b	This happens on the playground, in the street after school, in any group where one person says no and the rest keep pushing. The pushing feels like proof they are right. It is not. When a group cannot handle one person thinking differently they are usually not as sure as they look.	Is being pushed to agree the same as being wrong?	20	situations,peer pressure,identity,group dynamics
Q110	SIT	group pressure	3	youth	You went along with the group even though you knew it was a bad idea. It went wrong exactly like you thought it would. Someone asks whose idea it was. What do you do?	Say it was not your idea since you never wanted to do it	Stay quiet and let someone else speak	Say honestly that you had doubts but went along with it anyway	Blame the person who started it	c	This comes up in group projects, in dares, in plans that go wrong on the way home. Being honest that you went along even when you had doubts is harder than blaming someone else — but it is the thing that builds real trust.	What is the honest thing to say even when it is uncomfortable?	30	situations,honesty,accountability,group dynamics
Q111	SIT	follow-up pressure	2	youth	You said you needed more time to think. Now someone is saying you always do this and why can you never just go with things. How do you answer?	Say sorry and agree with them	Say nothing and go quiet	Say calmly that you just want to make sure it is a good idea before you say yes	Walk away from the group	c	This follow-up pressure happens in classrooms, friendship groups, sports teams — anywhere one person slows down to think and the group gets impatient. Always and never are words used to make you feel like the problem. One calm sentence is enough. You are thinking. That is allowed.	Does someone saying you always do something make it true?	20	situations,peer pressure,assertiveness,follow-up
Q112	SIT	follow-up pressure	2	youth	You told the group you did not want to climb through the building site fence and walked off. Now on Monday someone says you were scared. What do you do?	Explain to everyone why it was dangerous	Say nothing — people who know you will know it is not true	Agree that yes you were scared just to end it	Tell a teacher what they are saying	b	This happens after any moment where you made a sensible choice and someone wants to make it look weak. You made a good decision. Someone putting a label on it does not change that. The people who know you already know the truth.	Does a label someone gives you have to stick?	20	situations,resilience,peer pressure,follow-up
Q113	SIT	follow-up pressure	3	youth	You stayed friendly with the person the group was ignoring. Now someone is saying you are taking sides. Are you?	Yes — being friendly with someone is taking sides	No — being decent to someone is not the same as taking sides against everyone else	Maybe — you should have thought about that before	Yes — and you should apologise to the group	b	Being kind to one person does not mean you are against everyone else. Anyone saying it does is trying to force you to choose. In most cases you do not have to — and the person saying it knows that too.	Is being kind to someone the same as being against everyone else?	30	situations,kindness,peer pressure,follow-up
Q114	SIT	reading the room	1	youth	Last week the Primary 7s kicked your group off the far patch mid-game. Today everyone wants to play there again. Mia says are we sure about that? Everyone tells her to stop worrying. You are the one the group listens to. What do you do?	Go with the majority — most people want the far patch	Say look it happened last week — let's just use the other side today	Tell Mia she needs to just go with it	Say nothing — it is not your job	b	This happens in any group heading somewhere that caused a problem before. You were there. You know. Saying it simply and offering a direction forward is all it takes. The group follows because you moved first.	Does remembering what happened before help make a better decision now?	20	situations,leadership,reading the room,group dynamics
Q115	SIT	reading the room	2	youth	Your group is being horrible about someone who is not there. It is getting a bit much. Everyone is laughing. What do you do?	Join in — it is just a laugh	Go quiet but say nothing	Say something like alright that is enough and change the subject	Tell the group they are being horrible	c	This comes up in classrooms, group chats, changing rooms after PE, walking home. You do not need a speech. Saying alright that is enough and moving the conversation on is quick, not preachy, and it changes the energy in the room.	Does changing the subject need a big explanation?	20	situations,leadership,kindness,reading the room
Q116	SIT	reading the room	2	youth	You suggested something for the group project. Jamie said nah boring and moved on. Two minutes later Jamie said basically the same thing and everyone loved it. You are the one people listen to. What do you do?	Say nothing — at least it is a good idea	Say out loud hang on — did they not just say that?	Tell Jamie off after the lesson	Vote for a different idea just to make a point	b	This happens in group projects, team meetings, any group where one voice gets heard more. You have the influence to name what just happened without turning it into a fight. Saying it simply means the right person gets the credit.	Is it fair to let something like that go without saying anything?	20	situations,fairness,leadership,group dynamics
Q117	SIT	leadership	3	youth	Your group is about to do something you are pretty sure will get everyone in trouble. You can see it clearly. Nobody else seems bothered. What is the hardest but best thing to do?	Go along with it — if everyone gets in trouble at least you are together	Say nothing but do not join in	Say clearly this is going to go wrong and suggest something else	Wait until it goes wrong then say you knew it would	c	This comes up on the way home from school, in group dares, in plans that seem fine to everyone else but you can already see where they lead. Offering something else at the same time as saying it is wrong makes it easier for the group to turn around without feeling embarrassed.	Is it better to say something before it goes wrong or after?	30	situations,leadership,courage,group dynamics
Q118	SIT	follow-up pressure	2	youth	You said the group's plan was going to go wrong. It did not — it worked out fine. Now someone says you are always so negative. How do you handle that?	Apologise for saying it	Say you are glad it worked out and leave it there	Explain all the reasons you thought it would go wrong	Say well it might have gone wrong	b	This happens any time you raise a concern and it turns out fine. You were not wrong to say it. It is good that it worked out. Being genuinely glad about that and moving on is more powerful than defending yourself.	Do you need to win an argument to have been right to say something?	20	situations,resilience,follow-up,leadership
Q119	SIT	leadership	3	youth	You changed the group's direction and it worked. Now the person who wanted to do it the original way is being off with you. What do you do?	Apologise even though the decision was right	Give them a bit of space and check in with them later	Tell the group what they are doing	Be extra friendly so they have to come round	b	This comes up on sports teams, in friendship groups, anywhere your decision went against what someone else wanted. Someone being off when a decision went against them is normal. A bit of space and a quiet check-in later is nearly always enough.	Does a good decision mean everyone will be happy straight away?	30	situations,leadership,relationships,follow-up
Q120	EMO	body signals	1	youth	You are chosen to read out loud in class. Your voice goes wobbly even though you know the words perfectly. What is happening?	You are bad at reading	Your body got a surprise and is catching up — it happens to everyone	You should have practised more	You are showing off	b	This happens in class, at a sports presentation, reading something out at assembly. Your voice going wobbly when people are watching is your body reacting to being seen. It is not about how well you can read. It settles down the more you do it.	Is your wobbly voice about reading or about being watched?	10	emotions,body signals,anxiety,confidence
Q121	EMO	feelings	2	youth	You fell out with your best friend on Monday. By Wednesday you have both sort of moved on but something still feels a bit off. What is that feeling?	Proof the friendship is over	Your feelings catching up with what your head already decided — they take a bit longer	Nothing — just ignore it	A sign you should bring the argument back up	b	This leftover feeling happens after any kind of falling out — with a friend, on your team, even after a telling off that has been sorted. Your head moves on first and your feelings follow a bit later. The feeling usually fades on its own.	Can your head and your feelings be in different places at the same time?	20	emotions,friendship,feelings,recovery
Q122	EMO	self-awareness	3	youth	Something happened at home this morning and now you are at school and you cannot concentrate. You feel like you are watching the lesson through glass. What should you do?	Push through and pretend everything is fine	Tell a trusted adult you are having a hard morning	Cause a distraction so nobody notices	Go to the toilet and stay there	b	Things from outside follow us in — to school, to training, to anywhere we are supposed to be focused. You do not have to explain everything. Telling one trusted person takes ten seconds and means someone knows — which usually makes the rest of the day easier.	Does something that happened outside school stay outside when you walk in?	20	emotions,self-awareness,wellbeing,trust
Q123	SIT	group pressure	1	youth	Everyone in your group picks the same answer on a quiz. You picked something different. You are not sure if you are right or just different. What do you do?	Change your answer to match the group	Keep your answer — you picked it for a reason	Ask the teacher to check before you decide	Cross out your answer so nobody sees	b	This happens on quizzes, in group decisions, any time one person sees something differently from everyone else. Everyone else picking the same thing does not make it right. Keep your answer until you actually know it is wrong — not just because you are outnumbered.	Is everyone picking the same thing the same as everyone being right?	10	situations,peer pressure,confidence,identity
Q124	SIT	group dynamics	2	youth	Your group is laughing at the way someone in another group answered a question. You thought the answer was actually pretty good. What do you do?	Laugh along so you fit in	Stay quiet and keep your face straight	Say actually I thought that was a decent answer	Ask why everyone is laughing	c	This comes up in classrooms, watching someone perform, seeing someone try something new. One short sentence — actually I thought that was decent — is enough to stop a pile-on. Chances are you are not the only one in the group thinking it.	Does saying what you actually think always have to be a big deal?	20	situations,kindness,courage,group dynamics
Q125	SIT	follow-up pressure	3	youth	You kept your different answer on the quiz. You were right. Now the people who copied each other got it wrong. Someone says you only got it right by luck. What do you say?	Say nothing — being right is enough	Say maybe — but I kept my answer because I thought it through	Explain in detail how you worked it out	Say well you should have thought for yourself then	b	This comes after any moment where you went your own way and it paid off. You do not need to prove anything. Saying simply that you thought it through is calm and true. The result already did the talking.	Do you need to prove yourself when the result already shows it?	30	situations,resilience,follow-up,identity
Q126	SIT	leadership	1	youth	Your group cannot agree on what game to play. Everyone is getting a bit grumpy. Nobody is deciding. You have got an idea. What do you do?	Wait for someone else to decide	Say right — what about this and suggest something specific	Take a vote and make it official	Give up and play on your own	b	Groups get stuck like this on the playground, on sports teams, in any situation where nobody wants to go first. When a group is going in circles one person saying something specific moves things forward. That is not being bossy — it is being useful.	Is suggesting something the same as taking over?	10	situations,leadership,confidence,group dynamics
Q127	EMO	feelings	2	youth	You got picked for the team but your friend did not. You feel guilty even though it is not your fault. Is that feeling making sense?	No — you did nothing wrong so you should not feel anything	Yes — feeling bad when something good happens to you but not your friend is completely normal	No — you should just feel happy	Yes — you should tell the teacher to swap you out	b	This comes up whenever luck splits a group — one person gets picked and another does not, one person gets invited and another does not. Feeling guilty when something goes your way and not your friend's means you care about them. You do not need to fix it — just let it be there.	Can you feel two things at the same time about the same moment?	20	emotions,empathy,friendship,feelings
Q128	SIT	group dynamics	3	youth	Someone in your group has been left out all week. Nobody has said anything but everyone knows. The group keeps pretending it is not happening. What do you do?	Keep pretending along with everyone else	Go and sit with that person at lunch without making a big deal of it	Bring it up in front of the whole group	Tell a teacher everything	b	This happens in classrooms, on sports teams, in any group where someone has quietly been pushed to the edge. Going and sitting with someone without making a performance of it is the most useful single thing you can do and does not require anyone else to do anything.	Does fixing a big situation always need a big action?	30	situations,kindness,empathy,group dynamics
Q129	SIT	leadership	3	youth	You can see the group is leaving someone out and it is getting worse every day. You are the one people follow. What one thing would change it fastest?	Have a serious talk with the group about being kind	Just include that person yourself — the group will follow your lead	Write a note to the teacher	Wait — it will sort itself out	b	This works the same way in any group. When the person the group looks to includes someone, the group adjusts around that without needing a big conversation. You do not need a speech. You just need to do it once and mean it.	Does the person the group follows need to say something or just do something?	30	situations,leadership,kindness,group dynamics
Q130	SIT	follow-up pressure	2	youth	You stuck up for someone the group was leaving out. Now someone says you only did it to look good. What do you say?	Explain all your reasons for doing it	Say nothing — you know why you did it	Say maybe — but they still needed someone to sit with them	Ask why it matters why you did it	c	This challenge comes after any moment where you did something decent and someone questions your reason. Whether you did it to look good or not the person still needed someone. Saying so calmly ends the conversation. The reason does not change what actually happened.	Does the reason for doing something kind change whether it was the right thing to do?	20	situations,kindness,resilience,follow-up
